{
  "meta": {
    "source": "mediator_app",
    "timestamp": "2026-07-18T18:46:00",
    "operation": "update"
  },
  "textBindings": {
    "panel_backend_layers": "Spring Boot API connected",
    "status_global_healthy": "Healthy",
    "panel_dashboard_activity_feed": "Last sync: 6:46 PM"
  },
  "componentCreate": [
    {
      "name": "card_service_postgresql",
      "type": "FRAME",
      "x": 120,
      "y": 640,
      "width": 320,
      "height": 180,
      "style": {
        "fill": "#1E1E1E",
        "stroke": "#FFD700"
      },
      "text": "PostgreSQL Service"
    }
  ],
  "layoutRules": {
    "gridSize": 8,
    "padding": 16,
    "alignment": "left"
  }
}
